{
  "$schema": "https://json-schema.org/draft/2020-12/schema",
  "$id": "https://silveraiwolf.com/schemas/tutorial.schema.json",
  "title": "SilverAIWolf Tutorial Config",
  "description": "Defines a complete guided tutorial with ordered stages, markdown content, and declarative server-side verification rules. One JSON file = one tutorial. An AI agent can generate a new tutorial by filling this schema.",
  "type": "object",
  "required": ["id", "name", "stages"],
  "additionalProperties": false,
  "properties": {
    "id": {
      "type": "string",
      "pattern": "^[a-z0-9]+(-[a-z0-9]+)*$",
      "description": "Unique kebab-case identifier, e.g. 'databricks-end-to-end' or 'snowflake-quickstart'."
    },
    "name": {
      "type": "string",
      "description": "Human-readable tutorial name shown in the UI."
    },
    "description": {
      "type": "string",
      "description": "One-paragraph summary of what the learner builds and what platform it targets."
    },
    "platform": {
      "type": "string",
      "description": "Target platform identifier, e.g. 'databricks', 'snowflake', 'aws'."
    },
    "tags": {
      "type": "array",
      "items": { "type": "string" },
      "description": "Searchable tags for the marketplace, e.g. ['databricks', 'lakebase', 'medallion']."
    },
    "stages": {
      "type": "array",
      "minItems": 1,
      "description": "Ordered list of tutorial stages — learner walks them one at a time.",
      "items": { "$ref": "#/$defs/Stage" }
    }
  },

  "$defs": {
    "Stage": {
      "type": "object",
      "required": ["id", "phase", "label", "icon", "title"],
      "additionalProperties": false,
      "description": "A single stage in the tutorial. Stages are shown in order; each must be completed before the next unlocks.",
      "properties": {
        "id": {
          "type": "string",
          "pattern": "^[a-z0-9]+(-[a-z0-9]+)*$",
          "description": "Unique kebab-case stage identifier, e.g. 'landing-zone'."
        },
        "phase": {
          "type": "string",
          "description": "Phase grouping shown in the sidebar, e.g. 'Setup', 'Lakebase', 'Lakehouse', 'Analytics'."
        },
        "label": {
          "type": "string",
          "description": "Short label shown in the sidebar nav item."
        },
        "icon": {
          "type": "string",
          "description": "Single emoji shown next to the label."
        },
        "title": {
          "type": "string",
          "description": "Full page title shown in the content header, e.g. 'Landing Zone — Unity Catalog, schemas, and managed volume'."
        },
        "special": {
          "type": "string",
          "enum": ["connect"],
          "description": "If 'connect', renders the built-in workspace connection form instead of markdown content. Only used for the first stage."
        },
        "content": { "$ref": "#/$defs/StageContent" },
        "widgets": {
          "type": "array",
          "items": {
            "type": "string",
            "enum": ["table-browser", "live-feed"],
            "description": "'table-browser': live Lakebase row explorer (seed stage). 'live-feed': real-time LISTEN/NOTIFY event stream (refresh stage)."
          },
          "description": "Named interactive React widgets rendered after the markdown sections."
        },
        "verify": { "$ref": "#/$defs/VerifyConfig" }
      }
    },

    "StageContent": {
      "type": "object",
      "required": ["sections"],
      "additionalProperties": false,
      "description": "Markdown content for a stage — callout box + one or more instructional sections.",
      "properties": {
        "callout": { "$ref": "#/$defs/Callout" },
        "sections": {
          "type": "array",
          "minItems": 1,
          "items": { "$ref": "#/$defs/Section" },
          "description": "Ordered instructional sections. One section per major topic is typical."
        }
      }
    },

    "Callout": {
      "type": "object",
      "required": ["icon", "body"],
      "additionalProperties": false,
      "description": "Highlighted context box shown above the instructional sections.",
      "properties": {
        "icon": {
          "type": "string",
          "description": "Single emoji for the callout, matching the stage icon."
        },
        "body": {
          "type": "string",
          "description": "Markdown body. Explain WHAT the learner is building and WHY — the conceptual context, not the steps. Use **bold** for key terms and `code` for identifiers. Newlines are \\n in JSON."
        }
      }
    },

    "Section": {
      "type": "object",
      "required": ["heading", "body"],
      "additionalProperties": false,
      "description": "A titled instructional section with markdown body.",
      "properties": {
        "heading": {
          "type": "string",
          "description": "Section heading, e.g. 'What to do in stage 02 — create the Unity Catalog landing zone'."
        },
        "body": {
          "type": "string",
          "description": "Markdown body — numbered lists, fenced code blocks (```bash, ```sql, ```), inline `code`, **bold**, *italic*, and tables are all supported. Newlines are \\n in JSON. Indent code blocks inside list items with 3 spaces."
        }
      }
    },

    "VerifyConfig": {
      "type": "object",
      "required": ["checks"],
      "additionalProperties": false,
      "description": "Server-side verification that runs when the learner clicks 'Verify'. All checks must pass.",
      "properties": {
        "checks": {
          "type": "array",
          "minItems": 1,
          "items": {
            "oneOf": [
              { "$ref": "#/$defs/SqlCheck" },
              { "$ref": "#/$defs/PgCheck" },
              { "$ref": "#/$defs/PgEachCheck" },
              { "$ref": "#/$defs/PgOrRestCheck" },
              { "$ref": "#/$defs/RestCheck" },
              { "$ref": "#/$defs/StateCheck" }
            ]
          }
        }
      }
    },

    "SqlCheck": {
      "type": "object",
      "required": ["type", "name", "statement", "condition", "errorHint"],
      "additionalProperties": false,
      "description": "Run a SQL statement on the Databricks SQL warehouse (reads Delta tables, metric views, SHOW commands).",
      "properties": {
        "type": { "const": "sql" },
        "name": { "type": "string", "description": "Check label shown in the verify panel." },
        "statement": { "type": "string", "description": "SQL to run — SELECT, SHOW, or DESCRIBE." },
        "condition": {
          "oneOf": [
            { "$ref": "#/$defs/RowsGte" },
            { "$ref": "#/$defs/CountGt" },
            { "$ref": "#/$defs/AllInColumn" }
          ]
        },
        "successTemplate": { "type": "string", "description": "Detail shown on pass. Supports {count} and {found} placeholders." },
        "errorHint": { "type": "string", "description": "What the learner should do to fix a failing check." }
      }
    },

    "PgCheck": {
      "type": "object",
      "required": ["type", "name", "query", "condition", "errorHint"],
      "additionalProperties": false,
      "description": "Run a query on the Lakebase Postgres pool (pg_trigger, source tables, system catalogs).",
      "properties": {
        "type": { "const": "pg" },
        "name": { "type": "string" },
        "query": { "type": "string", "description": "SQL to run on the Postgres pool. Alias the count column as 'c' for count_gt checks." },
        "condition": {
          "oneOf": [
            { "$ref": "#/$defs/RowsGte" },
            { "$ref": "#/$defs/CountGt" }
          ]
        },
        "successTemplate": { "type": "string" },
        "errorHint": { "type": "string" }
      }
    },

    "PgEachCheck": {
      "type": "object",
      "required": ["type", "name_template", "query_template", "tables", "condition", "errorHint_template"],
      "additionalProperties": false,
      "description": "Expand into one PG count check per table — use for the seed stage pattern where every table must be non-empty.",
      "properties": {
        "type": { "const": "pg_each" },
        "name_template": { "type": "string", "description": "Check name with {table} placeholder, e.g. '{table} has rows'." },
        "query_template": { "type": "string", "description": "SQL with {table} placeholder, e.g. 'SELECT count(*)::int AS c FROM {table}'." },
        "tables": {
          "type": "array",
          "minItems": 1,
          "items": { "type": "string" },
          "description": "List of table names to expand into individual checks."
        },
        "condition": { "$ref": "#/$defs/CountGt" },
        "successTemplate": { "type": "string", "description": "Supports {count} and {table} placeholders." },
        "errorHint_template": { "type": "string", "description": "Supports {table} placeholder." }
      }
    },

    "PgOrRestCheck": {
      "type": "object",
      "required": ["type", "name", "pg_query", "rest_fn", "errorHint"],
      "additionalProperties": false,
      "description": "Try the PG pool first (live proof); if pool is not ready, fall back to the REST list. Use for the provision stage where the pool may not yet be initialised.",
      "properties": {
        "type": { "const": "pg_or_rest" },
        "name": { "type": "string" },
        "pg_query": { "type": "string", "description": "SQL to run on the PG pool, e.g. 'SELECT version()'." },
        "rest_fn": { "const": "listProjects", "description": "REST helper to call if the PG check fails." },
        "errorHint": { "type": "string" }
      }
    },

    "RestCheck": {
      "type": "object",
      "required": ["type", "name", "fn", "condition", "errorHint"],
      "additionalProperties": false,
      "description": "Call a named Databricks REST helper and find an item matching a regex.",
      "properties": {
        "type": { "const": "rest" },
        "name": { "type": "string" },
        "fn": {
          "type": "string",
          "enum": ["listDashboards", "listGenieSpaces"],
          "description": "'listDashboards': GET /api/2.0/lakeview/dashboards. 'listGenieSpaces': GET /api/2.0/genie/spaces."
        },
        "condition": { "$ref": "#/$defs/FindMatch" },
        "successTemplate": { "type": "string", "description": "Supports {field} placeholders from the matched item, e.g. '{display_name}'." },
        "errorHint": { "type": "string" },
        "on_404": { "type": "string", "description": "Custom error when the REST endpoint returns 404 (feature not enabled)." }
      }
    },

    "StateCheck": {
      "type": "object",
      "required": ["type", "name", "key", "errorHint"],
      "additionalProperties": false,
      "description": "Assert an in-memory server state value. Currently only 'isListening' is supported.",
      "properties": {
        "type": { "const": "state" },
        "name": { "type": "string" },
        "key": { "const": "isListening", "description": "True when the server holds an active LISTEN connection to Postgres." },
        "successTemplate": { "type": "string" },
        "errorHint": { "type": "string" }
      }
    },

    "RowsGte": {
      "type": "object",
      "required": ["op", "n"],
      "additionalProperties": false,
      "description": "Pass if the SQL/PG result set has at least n rows.",
      "properties": {
        "op": { "const": "rows_gte" },
        "n": { "type": "integer", "minimum": 0 }
      }
    },

    "CountGt": {
      "type": "object",
      "required": ["op", "n"],
      "additionalProperties": false,
      "description": "Parse the first column of the first row as an integer; pass if > n. Use with SELECT count(*) queries.",
      "properties": {
        "op": { "const": "count_gt" },
        "n": { "type": "integer", "minimum": 0 }
      }
    },

    "AllInColumn": {
      "type": "object",
      "required": ["op", "column", "values"],
      "additionalProperties": false,
      "description": "Pass if every expected value appears in the given column of the result set (0-indexed).",
      "properties": {
        "op": { "const": "all_in_column" },
        "column": { "type": "integer", "minimum": 0 },
        "values": {
          "type": "array",
          "minItems": 1,
          "items": { "type": "string" }
        }
      }
    },

    "FindMatch": {
      "type": "object",
      "required": ["op", "fields", "pattern"],
      "additionalProperties": false,
      "description": "Pass if any item in the REST list has at least one of the given fields matching the pattern.",
      "properties": {
        "op": { "const": "find_match" },
        "fields": {
          "type": "array",
          "minItems": 1,
          "items": { "type": "string" },
          "description": "Try each field in order, e.g. ['display_name'] or ['title', 'name']."
        },
        "pattern": { "type": "string", "description": "JavaScript regex pattern, e.g. 'silverline'." },
        "flags": { "type": "string", "description": "Regex flags, e.g. 'i' for case-insensitive." }
      }
    }
  }
}
