{
  "id": "databricks-end-to-end",
  "name": "Databricks End-to-End",
  "description": "A full tour of Databricks Free Edition across 12 ordered stages — from Unity Catalog and Lakebase to the medallion, semantic layer, and AI/BI Genie. $0, serverless, no cloud account required.",
  "platform": "databricks",
  "tags": ["databricks", "lakebase", "unity-catalog", "medallion", "dbt", "ai-bi", "genie", "free-edition"],
  "stages": [
    {
      "id": "connect",
      "phase": "Setup",
      "label": "Connect",
      "icon": "🔌",
      "title": "Connect — point the app at your workspace",
      "special": "connect"
    },

    {
      "id": "landing-zone",
      "phase": "Setup",
      "label": "Landing Zone",
      "icon": "🗂️",
      "title": "Landing Zone — Unity Catalog, schemas, and managed volume",
      "content": {
        "callout": {
          "icon": "🗂️",
          "body": "**Unity Catalog** is Databricks' governance layer — a three-level namespace (catalog → schema → table/volume) with access control, lineage, and data discovery built in. You own one catalog: `silverline`, with three schemas that mirror the medallion architecture (`bronze` / `silver` / `gold`) and a **managed volume** for files.\n\n**Managed** means Databricks owns the storage lifecycle — drop the volume and the files are deleted. **External** means your own cloud bucket — drop the volume registration and the files are kept. For Free Edition we use managed volumes (no cloud account needed)."
        },
        "sections": [
          {
            "heading": "What to do in stage 02 — create the Unity Catalog landing zone",
            "body": "1. In the workspace, open the **SQL editor** (left sidebar → SQL Editor).\n\n2. Run this block to create the catalog and medallion schemas (idempotent — safe to re-run):\n\n   ```sql\n   CREATE CATALOG IF NOT EXISTS silverline\n     COMMENT 'Shared landing zone for all tutorial phases.';\n   CREATE SCHEMA IF NOT EXISTS silverline.bronze COMMENT 'Raw / ingested';\n   CREATE SCHEMA IF NOT EXISTS silverline.silver COMMENT 'Cleaned / current-state';\n   CREATE SCHEMA IF NOT EXISTS silverline.gold   COMMENT 'Business / serving';\n   ```\n\n3. Create the managed volume for seed files and contract PDFs:\n\n   ```sql\n   CREATE VOLUME IF NOT EXISTS silverline.bronze.files\n     COMMENT 'Managed volume — seed files + contract PDFs for the RAG track.';\n   ```\n\n4. Verify your work:\n\n   ```sql\n   SHOW SCHEMAS IN silverline;       -- expect bronze, silver, gold\n   SHOW VOLUMES IN silverline.bronze; -- expect files\n   ```\n\n5. Browse to **Catalog Explorer** in the UI (left sidebar → Catalog) to see `silverline` and its schemas — this is what Unity Catalog looks like."
          }
        ]
      },
      "verify": {
        "checks": [
          {
            "type": "sql",
            "name": "silverline catalog exists",
            "statement": "SHOW CATALOGS LIKE 'silverline'",
            "condition": { "op": "rows_gte", "n": 1 },
            "successTemplate": "catalog silverline found",
            "errorHint": "Run: CREATE CATALOG IF NOT EXISTS silverline in the SQL editor"
          },
          {
            "type": "sql",
            "name": "bronze, silver, gold schemas present",
            "statement": "SELECT schema_name FROM silverline.information_schema.schemata WHERE schema_name IN ('bronze','silver','gold') ORDER BY schema_name",
            "condition": { "op": "all_in_column", "column": 0, "values": ["bronze", "silver", "gold"] },
            "errorHint": "Run: CREATE SCHEMA IF NOT EXISTS silverline.bronze (and silver, gold)"
          },
          {
            "type": "sql",
            "name": "managed volume in silverline.bronze",
            "statement": "SHOW VOLUMES IN silverline.bronze",
            "condition": { "op": "rows_gte", "n": 1 },
            "successTemplate": "volume found in silverline.bronze",
            "errorHint": "Run: CREATE VOLUME IF NOT EXISTS silverline.bronze.files in the SQL editor"
          }
        ]
      }
    },

    {
      "id": "project",
      "phase": "Setup",
      "label": "Project · dbt",
      "icon": "🛠️",
      "title": "Project · dbt — local tooling (mise, uv, dbt via OAuth)",
      "content": {
        "callout": {
          "icon": "🛠️",
          "body": "**Local tooling** is the \"project\" layer — `mise` (task runner), `uv` (Python package manager), and `dbt` (SQL transformations). Together they give you a reproducible, one-command dev environment for the whole tutorial.\n\ndbt uses **OAuth** to talk to the Starter Warehouse — no PAT or password stored in any config file. The `free` profile you authenticated in stage 01 is the only credential dbt needs."
        },
        "sections": [
          {
            "heading": "What to do in stage 03 — set up local tooling",
            "body": "1. In the repo at `tutorials/databricks/end-to-end/`, copy `.env.sample` to `.env` and fill in your workspace URL and Starter Warehouse ID from stage 01.\n\n2. Run `mise run setup` — installs `dbt-databricks`, `databricks-sdk`, and `databricks-sql-connector` via uv into a local virtual environment.\n\n3. Run `mise run dbt:debug` — proves dbt can reach the warehouse and `silverline` catalog via OAuth.\n   Expect: **All checks passed!**\n\n4. Smoke test:\n\n   ```bash\n   mise run sql 'SELECT current_catalog(), current_user()'\n   ```\n\n   Expect: `silverline | <your email>`\n\n5. If `dbt debug` fails on auth, re-run `databricks auth login --profile free` — the cached OAuth token may have expired (they last ~50 minutes)."
          }
        ]
      }
    },

    {
      "id": "provision",
      "phase": "Lakebase",
      "label": "Provision",
      "icon": "🐘",
      "title": "Provision — create the Lakebase PG17 autoscaling project",
      "content": {
        "callout": {
          "icon": "🐘",
          "body": "**Lakebase** is Databricks' serverless Postgres 17. An **Autoscaling project** auto-scales and idles to ~0 quota when unused — you pay (in quota) only for active connections. Auth uses **short-lived OAuth tokens** minted on demand as the Postgres password — nothing static is stored or committed.\n\n**PG17 matters** because Lakebase CDF (native CDC) requires it. Use `postgres create-project`, not `database create-database-instance` — the latter only gives PG16."
        },
        "sections": [
          {
            "heading": "What to do in stage 04 — provision the Lakebase project",
            "body": "1. Create the PG17 Autoscaling project via the Databricks CLI:\n\n   ```bash\n   databricks --profile free postgres create-project silverline-oltp \\\n     --json '{\"spec\":{\"pg_version\":17}}' --timeout 15m -o json\n   ```\n\n   Expect `pg_version: 17` in the output. This takes 1–2 minutes.\n\n2. Capture the endpoint host:\n\n   ```bash\n   EP=projects/silverline-oltp/branches/production/endpoints/primary\n   databricks --profile free postgres get-endpoint \"$EP\" -o json\n   ```\n\n   Copy the `status.hosts.host` value into your `.env` as `LAKEBASE_HOST`.\n\n3. Mint a credential and verify connectivity:\n\n   ```bash\n   TOKEN=$(databricks --profile free postgres generate-database-credential \"$EP\" \\\n     -o json | jq -r '.token')\n   # then connect with psql and run:\n   SELECT version();\n   # expect: PostgreSQL 17.x over SSL\n   ```\n\n4. Add to `.env`:\n\n   ```\n   LAKEBASE_DB=databricks_postgres\n   LAKEBASE_USER=<your-databricks-email>\n   ```"
          }
        ]
      },
      "verify": {
        "checks": [
          {
            "type": "pg_or_rest",
            "name": "Lakebase project is provisioned and reachable",
            "pg_query": "SELECT version()",
            "rest_fn": "listProjects",
            "errorHint": "Run: databricks --profile free postgres create-project silverline-oltp --json '{\"spec\":{\"pg_version\":17}}'"
          }
        ]
      }
    },

    {
      "id": "seed",
      "phase": "Lakebase",
      "label": "Seed",
      "icon": "🌱",
      "title": "Seed — load Silverline Capital's 9-table OLTP",
      "content": {
        "callout": {
          "icon": "🌱",
          "body": "The seed stage loads **Silverline Capital's full 9-table operational model** into Lakebase. It uses a deterministic script (`MOCK_SEED=42`) so results are identical every run — safe to re-run if anything goes wrong.\n\nThe data represents a fictional equipment lease & loan finance company's full lifecycle: customers → applications → contracts → equipment → billing → payments."
        },
        "sections": [
          {
            "heading": "What to do in stage 05 — seed Lakebase",